{
  "schema_version": 1,
  "name": "provider",
  "summary": "TODO: one line — which credential, for which hosts, and what the lab gets",
  "min_stack": "1.7.0",
  "load_band": "provider",
  "hosts": ["api.provider.invalid"],
  "secrets": [
    {
      "env": "PROVIDER_TOKEN_PATH",
      "file": "provider.token",
      "prompt": "TODO: what to paste, in the words the operator will recognise"
    }
  ],
  "broker_routes": [
    { "path": "/provider/cred", "exposed": false }
  ]
}
